cheese open sandwich,274.0680847167969,9.84000015258789,14.242727279663086,28.419090270996094,sandwich,150.73745727539062,grilled tomato and cheese sandwich recipe,"4 Whole Wheat Brown Bread,2 tablespoon Butter,2 Tomatoes - sliced,2 Cheese,Salt - to taste,Black pepper powder - to taste,Dried oregano - as required",Vegetarian,86
sunset and sunrise open sandwich,241.3109130859375,8.580724716186523,15.136857986450195,18.89407730102539,sandwich,199.68478393554688,fruit sandwich recipe,"3 Whole Wheat Brown Bread,2 Ripe Bananas - peeled and sliced,2 Pineapple - sliced thin,1 Apple - or chickoo,2 tablespoon Jam - Mixed fruit",Vegetarian,73
danish luncheon sandwich,193.8192596435547,9.027264595031738,10.095224380493164,17.767698287963867,sandwich,167.411376953125,fruit sandwich recipe,"3 Whole Wheat Brown Bread,2 Ripe Bananas - peeled and sliced,2 Pineapple - sliced thin,1 Apple - or chickoo,2 tablespoon Jam - Mixed fruit",Vegetarian,73
chicken and corn open sandwich,188.1591033935547,8.629572868347168,8.834002494812012,19.211580276489254,sandwich,203.9174346923828,chicken sandwich with sweet corn recipe,"1 Chicken breasts - pressure cooked till tender (3 whistles),3 tablespoon Sweet corn - boiled till tender,4 tablespoon Classic Mayonnaise (With Egg) - (garlic flavour tastes best),Salt - to taste,3 tablespoon Tomato Ketchup,Whole Black Peppercorns - freshly ground to taste,2 Hot Dog Bread,2 Iceberg lettuce - as needed,1 Tomato - sliced (4-5 slices),1 Onion - sliced to rings (about 5 slices)",High Protein Non Vegetarian,82
chocolate sponge cake,239.85745239257807,9.134881019592283,5.509288787841797,39.542179107666016,piece,168.69973754882812,chocolate flan cake recipe,"1-3/4 cups Vivatta Maida - (225grams),2 cups Sugar,3/4 cup Cocoa Powder,1-1/2 teaspoon Baking powder,1-1/2 teaspoon Baking soda,1/2 teaspoon Salt,2 Whole Eggs,1 cup Milk,1/2 cup Sunflower Oil,2 teaspoon Vanilla Extract,1 cup Hot water,4 fl oz Britannia Cream Cheese - softened,4 Whole Eggs - at room temperature,14 fl oz Condensed Milk,12 fl oz Evaporated milk,1 teaspoon Vanilla Extract",Eggetarian,85
chocolate swiss roll,306.0789489746094,6.009129047393799,19.755830764770508,26.972558975219727,swiss roll,145.00489807128906,spicy hot chocolate recipe - perfect drink for a rainy day or winters,"3 cups Milk,1 cup Dark chocolate - cut into pieces,1 teaspoon Cinnamon Powder (Dalchini),1/4 teaspoon Black pepper powder,1/4 teaspoon Cayenne Pepper - optional,1 teaspoon Vanilla Extract,Fresh Cherries - for garnish,Slivered Almonds (Badam) - a few",Vegetarian,82
lemon curd filling,225.6240081787109,3.432499885559082,12.577499389648438,26.405000686645508,tablespoon,56.40600204467773,classic cheesecake recipe with lemon curd made using preethi electric pressure cooker,"2 Whole Eggs,2 Egg yolks,3/4 cup Caster Sugar,1/3 cup Butter (unsalted) - chilled,pinch Lemon zest,2 Lemon - juice of the 2 lemons,15 Ginger Cookies,1/4 cup Butter - finely chopped,400 grams Britannia Cream Cheese,3/4 cup Sugar,2 tablespoons All Purpose Flour (Maida),1/8 teaspoon Salt,1/4 cup Hung Curd (Greek Yogurt),1 teaspoon Vanilla Extract,2 Whole Eggs",Eggetarian,71
jam filling,184.61538696289065,0.0,0.0,46.153846740722656,tablespoon,30.0,bharwa karela with sweet potato filling recipe,"5 Karela (Bitter Gourd/ Pavakkai),2 Sweet Potatoes - boiled,2 Tomatoes - chopped,1 inch Ginger - chopped,1 Green Chillies,1/4 teaspoon Turmeric powder (Haldi),1/2 teaspoon Red Chilli powder,1 teaspoon Garam masala powder,1 teaspoon Chaat Masala Powder,Salt - as needed,Sunflower Oil - to cook",Vegetarian,78
chocolate pastry,243.36962890625,7.053058624267578,10.122756958007812,32.23630905151367,pastry,211.93235778808597,nut filled chocolate pastry recipe,"1 Puff Pastry Sheet,1 Chocolate Bar,8 Cashew nuts - crushed,1 Whole Egg,Caster Sugar - as needed",Eggetarian,100
assorted pastry,230.7379302978516,6.775999546051025,8.909843444824219,31.9851016998291,pastry,185.3575592041016,spiced coconut oatmeal with assorted fruits recipe,"1/2 cup Instant Oats (Oatmeal),1 cup Lukewarm Water,1/4 cup Coconut milk,2 teaspoons Honey,1/4 teaspoon Cinnamon Powder (Dalchini),1/8 teaspoon Dry ginger powder,2 Ripe Bananas - sliced,3 Dates - sliced,2 tablespoon Anardana Powder (Pomegranate Seed Powder),2 tablespoons Walnuts,Salt - a pinch",Vegetarian,70
orange gateau,178.0481414794922,4.779430866241455,6.021613121032715,27.01242446899414,piece,142.10467529296875,orange rasam recipe,"1 tablespoon Ghee,1/2 teaspoon Mustard seeds,2 teaspoon Cumin seeds (Jeera),5 Curry leaves,1/4 teaspoon Asafoetida (hing),4 cloves Garlic - crushed,5 Tomatoes - chopped & pureed,2 cups Fresh orange juice,Lemon - juice from half,1/2 teaspoon Turmeric powder (Haldi),1 Red Chilli powder,1 teaspoon Cumin powder (Jeera),1 teaspoon Coriander Powder (Dhania),1/2 teaspoon Black pepper powder,Salt - to taste,Coriander (Dhania) Leaves - freshly chopped,1/4 cup Arhar dal (Split Toor Dal) - cooked (optional)",Vegetarian,72
black forest gateau,217.81735229492188,5.938715934753418,8.580164909362793,30.56795883178711,piece,142.76112365722656,black forest cake recipe,"1 cup All Purpose Flour (Maida),1 teaspoon Baking powder,6 tablespoons Cocoa Powder,1.5 cups Sugar,100 grams Butter (unsalted),4 Whole Eggs - at room temperature,3 teaspoon Vanilla Extract,4 tablespoons Hung Curd (Greek Yogurt),500 grams Heavy whipping cream,1/2 cup Icing Sugar - + 4 tablespoons more,1/2 cup Cherry Compote,1/2 cup Canned Cherries - if fresh available use fresh cherries,250 grams Dark chocolate,1/2 cup Chocolate Shavings,2 tablespoons Dark Chocolate Chips,2 tablespoons Chocolate chips - white chocolate,1 cup Dark chocolate - or milk chocolate",Eggetarian,83
lemon cake,373.8514099121094,5.285655498504639,20.627254486083984,43.10041046142578,piece,228.0493621826172,orange lemon tea cake recipe,"2-1/2 cups Whole Wheat Flour,1 cup Caster Sugar,2 teaspoons Baking powder,1/4 teaspoon Salt,1/4 teaspoon Orange Zest (Rind),1/4 cup Fresh orange juice,1 teaspoon Lemon juice,1/4 cup Milk,1/2 cup Extra Virgin Olive Oil,4 Whole Eggs",Eggetarian,100
victorian sandwich cake,373.08837890625,5.180116653442383,19.834306716918945,44.73898696899414,piece,239.242919921875,fruit sandwich recipe,"3 Whole Wheat Brown Bread,2 Ripe Bananas - peeled and sliced,2 Pineapple - sliced thin,1 Apple - or chickoo,2 tablespoon Jam - Mixed fruit",Vegetarian,73
chocolate eggless cake,312.00604248046875,6.663639068603516,13.189111709594728,43.44585037231445,piece,357.24688720703125,eggless chocolate banana cake recipe,"170 grams Butter (unsalted) - at room temperature,170 grams Caster Sugar,135 grams Dark chocolate,280 grams Vivatta Maida,3 1/2 teaspoons Baking powder,1 Pinch Salt,1/2 teaspoon Baking soda,2 Ripe Bananas - (small variety over ripe),2 tablespoons Chocolate chips,3 tablespoons Flax seed powder (flax meal),9 tablespoons Chilled water,9 tablespoons Chilled water",Vegetarian,100
orange eggless cake,355.6209411621094,7.156638622283936,13.820504188537598,52.64521026611328,piece,352.6574401855469,eggless whole wheat and orange almond cake recipe,"1-1/2 cups Whole Wheat Flour,1/2 cup Almond Meal (Badam Powder),1/2 cup Condensed Milk,1/2 cup Fresh orange juice - fresh or canned,50 grams Butter - cold,2/3 cup Sunflower Oil,1 teaspoon Baking soda,1 tablespoon Baking powder,pinch Salt,1/2 teaspoon Cinnamon Powder (Dalchini),1/2 tablespoon Vanilla Extract,1/2 cup Buttermilk,1 cup Badam (Almond) - sliced or blanched,1/4 cup Pistachios,1/4 cup Walnuts - diced",Vegetarian,100
chocolate glace icing,436.29241943359375,3.217336893081665,20.796449661254883,62.43446350097656,tablespoon,104.4375,spicy hot chocolate recipe - perfect drink for a rainy day or winters,"3 cups Milk,1 cup Dark chocolate - cut into pieces,1 teaspoon Cinnamon Powder (Dalchini),1/4 teaspoon Black pepper powder,1/4 teaspoon Cayenne Pepper - optional,1 teaspoon Vanilla Extract,Fresh Cherries - for garnish,Slivered Almonds (Badam) - a few",Vegetarian,82
butter icing,500.7160339355469,0.1859259307384491,25.37111091613769,71.63703918457031,tablespoon,81.11599731445312,butter chicken recipe - the classic indian chicken gravy,"300 grams Boneless chicken - cut into pieces,1/2 cup Curd (Dahi / Yogurt),2 teaspoon Ginger Garlic Paste,1/2 teaspoon Turmeric powder (Haldi),1/2 teaspoon Garam masala powder,1 teaspoon Kashmiri Red Chilli Powder,1 teaspoon Salt,1 tablespoon Butter,1 teaspoon Red Chilli powder,1 teaspoon Coriander Powder (Dhania),1/2 teaspoon Garam masala powder,1 cup Homemade tomato puree,1 teaspoon Honey,1/4 cup Fresh cream,1 tablespoon Kasuri Methi (Dried Fenugreek Leaves),Salt - to taste,1/4 cup Fresh cream,1 tablespoon Kasuri Methi (Dried Fenugreek Leaves),Salt - to taste",High Protein Non Vegetarian,77
chocolate butter icing,469.5876159667969,3.2068042755126958,24.765565872192383,61.71752548217773,tablespoon,91.0999984741211,oats peanut butter & chocolate chip trail mix recipe,"1-1/2 cups Rolled Oats,3/4 cup Coconut flakes,1/2 cup Watermelon seeds,1/3 cup Sesame seeds (Til seeds),3/4 cup Chocolate chips,1/2 cup Peanut Butter,1/4 cup Lion Dates Syrup",Vegetarian,84
almond biscuit (badam ke biscuit),407.7389526367188,6.245248794555664,19.704784393310547,52.14155960083008,biscuit,75.73751068115234,almond butter recipe,"1 cup Badam (Almond),1 tablespoon Extra Virgin Olive Oil",Eggetarian,74
orange biscuit,354.7797546386719,3.6271817684173584,11.012979507446287,62.11175155639648,biscuit,214.64175415039065,moon biscuits recipe (moon shaped baked cookies),"300 grams Vivatta Maida,75 grams Sugar,175 grams Butter (unsalted),15 grams Milk Powder,1 pinch Baking powder,1/2 teaspoon Vanilla Extract",Vegetarian,74
gingerman biscuit,357.4268798828125,6.256139755249023,12.729915618896484,55.24462890625,gingerman,127.02951049804688,atta biscuit recipe (whole wheat flour cookies spiced with cardamom),"1-1/2 cups Whole Wheat Flour,1/4 cup Wheat Bran,1/2 cup Caster Sugar,10 Cardamom (Elaichi) Pods/Seeds - peeled and powdered,100 grams Butter (unsalted) - chilled and cubed,1 pinch Salt,1/4 cup Milk,8 Cashew nuts - halved lengthwise",Vegetarian,74
coffee drops,443.0706787109375,7.569732666015625,27.16364288330078,43.056129455566406,small,52.29618453979492,cold coffee recipe,"2 tablespoon Instant Coffee Powder,2 cups Milk,2 tablespoons Sugar - powdered,1/2 cup Ice cream - vanilla or chocolate (optional),Ice cubes - as required",Vegetarian,71
christmas biscuit,406.070068359375,5.666867733001709,15.882678985595703,60.97199630737305,biscuit,84.10726165771484,atta biscuit recipe (whole wheat flour cookies spiced with cardamom),"1-1/2 cups Whole Wheat Flour,1/4 cup Wheat Bran,1/2 cup Caster Sugar,10 Cardamom (Elaichi) Pods/Seeds - peeled and powdered,100 grams Butter (unsalted) - chilled and cubed,1 pinch Salt,1/4 cup Milk,8 Cashew nuts - halved lengthwise",Vegetarian,74
christmas wreath biscuit,386.04632568359375,5.430278778076172,15.008878707885742,58.066932678222656,biscuit,84.7854232788086,atta biscuit recipe (whole wheat flour cookies spiced with cardamom),"1-1/2 cups Whole Wheat Flour,1/4 cup Wheat Bran,1/2 cup Caster Sugar,10 Cardamom (Elaichi) Pods/Seeds - peeled and powdered,100 grams Butter (unsalted) - chilled and cubed,1 pinch Salt,1/4 cup Milk,8 Cashew nuts - halved lengthwise",Vegetarian,74
christmas bell biscuit,404.8484497070313,5.661853313446045,15.838507652282717,60.78856658935547,biscuit,84.10726165771484,atta biscuit recipe (whole wheat flour cookies spiced with cardamom),"1-1/2 cups Whole Wheat Flour,1/4 cup Wheat Bran,1/2 cup Caster Sugar,10 Cardamom (Elaichi) Pods/Seeds - peeled and powdered,100 grams Butter (unsalted) - chilled and cubed,1 pinch Salt,1/4 cup Milk,8 Cashew nuts - halved lengthwise",Vegetarian,74
christmas star biscuit,392.0292053222656,3.539636611938477,10.036406517028809,74.54273223876953,biscuit,145.6388397216797,atta biscuit recipe (whole wheat flour cookies spiced with cardamom),"1-1/2 cups Whole Wheat Flour,1/4 cup Wheat Bran,1/2 cup Caster Sugar,10 Cardamom (Elaichi) Pods/Seeds - peeled and powdered,100 grams Butter (unsalted) - chilled and cubed,1 pinch Salt,1/4 cup Milk,8 Cashew nuts - halved lengthwise",Vegetarian,74
christmas tree biscuit,385.6335144042969,5.429709911346436,14.99578857421875,58.41240692138672,biscuit,84.69476318359375,eggless christmas tree chocolate cookies recipe,"2-1/4 cups All Purpose Flour (Maida),1/4 cup Cocoa Powder,1 cup Butter,1/2 cup Caster Sugar,1 teaspoon Baking powder,1 teaspoon Sunflower Oil,1 teaspoon Vanilla Extract,2 tablespoons Water,1/2 cup Butter,1-1/2 cup Caster Sugar,1/2 teaspoon Vanilla Extract,1 tablespoon Water,Decorative sugar (Cake/ Candy Sprinkles) - (preferably",Vegetarian,78
chocolate cream shells,427.1673278808594,5.10318660736084,19.337682723999023,59.26133728027344,shell,98.1950912475586,spicy hot chocolate recipe - perfect drink for a rainy day or winters,"3 cups Milk,1 cup Dark chocolate - cut into pieces,1 teaspoon Cinnamon Powder (Dalchini),1/4 teaspoon Black pepper powder,1/4 teaspoon Cayenne Pepper - optional,1 teaspoon Vanilla Extract,Fresh Cherries - for garnish,Slivered Almonds (Badam) - a few",Vegetarian,82
jelly biscuit,404.61334228515625,4.229109764099121,19.33068084716797,55.243629455566406,biscuit,72.4510726928711,indian style jeera biscuit recipe,"1 cup All Purpose Flour (Maida),1 teaspoon Baking powder,1 teaspoon Salt,1 tablespoon Butter - chilled and cut into small pieces,1 teaspoon Cumin seeds (Jeera) - roasted,1/4 cup Lukewarm Water",Vegetarian,77
cherry and walnut cookies,422.6035461425781,5.625301361083984,18.750593185424805,59.35258483886719,cookies,74.27257537841797,oatmeal cherry cookies recipe,"2 cups All Purpose Flour (Maida),2 cups Instant Oats (Oatmeal),1 teaspoon Baking powder,1/2 teaspoon Salt,3/4 cup Butter,1 cup Caster Sugar,2 tablespoon Curd (Dahi / Yogurt),1 teaspoon Vanilla Extract,1/2 cup Canned Cherries",Vegetarian,78
cheese straws,382.0014343261719,9.832524299621582,24.284299850463867,30.60818862915039,straw,36.85358810424805,cheese tarts recipe,"1 cup Vivatta Maida,50 grams Butter - at room temperature salted or unsalted,1/4 cup Icing Sugar,1 Whole Eggs,1 teaspoon Vanilla Extract,Salt - a pinch if you are using unsalted butter,2 tablespoons Milk Powder,1 packet Britannia Cream Cheese - if you find it difficult to get cream cheese all you can do is take grated paneer add pinch salt n grind it in your mixer,1/3 cup Mozzarella cheese,1/4 cup Sugar,1 teaspoon Vanilla Extract,1 teaspoon Lemon juice - can add lemon zest as well,1 Whole Egg - 2 eggs depending on how many tarts you have prepared,1/4 cup Milk,1 teaspoon Corn flour,Salt - a pinch,25 grams Butter - 25 grams of butter,1 Egg yolks - or 2",Vegetarian,80
butterfly biscuit,341.447021484375,9.976067543029783,22.11424446105957,25.331756591796875,biscuit,41.47727584838867,atta biscuit recipe (whole wheat flour cookies spiced with cardamom),"1-1/2 cups Whole Wheat Flour,1/4 cup Wheat Bran,1/2 cup Caster Sugar,10 Cardamom (Elaichi) Pods/Seeds - peeled and powdered,100 grams Butter (unsalted) - chilled and cubed,1 pinch Salt,1/4 cup Milk,8 Cashew nuts - halved lengthwise",Vegetarian,74
flan pastry,445.7974243164063,6.723062038421631,25.04267883300781,47.8392333984375,pastry,232.9291534423828,apple tart with puff pastry recipe (open pie),"1 Puff Pastry Sheet,1 Apple - sliced,1/4 teaspoon Cinnamon Powder (Dalchini),1/3 cup Brown Sugar (Demerara Sugar)",Vegetarian,71
fruit flan,261.352294921875,3.2990219593048096,12.48317050933838,34.71337890625,flan,1215.941650390625,fruit-chia rice paper rolls in a mango tahini dipping sauce recipe,"Rice paper rolls - as needed,2 Fresh Figs - sliced,2 Strawberries - sliced,1 Kiwi - sliced,Mint Leaves (Pudina) - mint leaves as needed,1/4 cup Chia Seeds,1 cup Coconut milk - or almond milk,1/2 teaspoon Vanilla Extract,2 tablespoons Maple syrup - or honey,3 tablespoons Badam (Almond) - flaked,1 cup Mango (Ripe) - diced,1 teaspoon Tahini,1 Fresh Red Chilli,1 tablespoon Lemon juice,1 pinch Salt,2-3 tablespoons Coconut milk,1/4 teaspoon Sriracha sauce - optional,1 Spring Onion (Bulb & Greens) - finely sliced,1/2 teaspoon Black sesame seeds - or white sesame seeds,Red Chilli powder - a pinch",Vegetarian,100
orange cream flan,280.2833557128906,4.7347025871276855,13.58536434173584,36.16187286376953,flan,1132.7652587890625,flourless orange cake with cream cheese frosting recipe,"3 Oranges - peeled,2 tablespoons Orange Zest (Rind),3 tablespoons Sugar,6 Whole Eggs,175 grams Caster Sugar,150 grams Almond Meal (Badam Powder),100 grams Hazelnut Meal (Powder),1 teaspoon Baking powder,200 grams Britannia Cream Cheese,3 tablespoons Heavy whipping cream,3 tablespoons Fresh orange juice,75 grams Icing Sugar",Eggetarian,83
fruit puree tart,286.5020751953125,3.3468210697174072,16.827314376831055,30.41661262512207,tart,159.402587890625,fruit tart recipe - vegan,"2 cups Instant Oats (Oatmeal),1 cup Badam (Almond),4 tablespoons Flax seed powder (flax meal),5 tablespoon Coconut Oil - or melted butter,1/3 cup Maple syrup - or honey,1/2 cup Almond Milk (Badam Milk) - or milk,4 tablespoon Hung Curd (Greek Yogurt),4 tablespoon Peanut Butter,4 tablespoon Jam,Fresh fruits - bananas",Vegan,100
apple banana pie,243.98855590820312,3.1279330253601074,11.39358901977539,32.115875244140625,pie,948.4566650390624,banana-almond butter bread recipe,"1 Ripe Bananas - (over ripe),1 Whole Egg,1/4 cup Sugar,2-1/2 tablespoons Almond butter,5 tablespoons Vivatta Maida,3 tablespoons Almond Meal (Badam Powder),1/2 teaspoon Baking powder,1/4 teaspoon Baking soda,1/4 teaspoon Cinnamon Powder (Dalchini),1 pinch Salt,1/4 teaspoon Vanilla Extract - or almond extract,2 tablespoons Slivered Almonds (Badam),2 tablespoons Chocolate ganache - or melted chocolate",Eggetarian,100
lemon chiffon pie,259.3120422363281,4.878358364105225,14.515484809875488,27.6345157623291,pie,1389.91259765625,lemon grilled chicken recipe,"1 Chicken breasts,1 Lemon juice,1 teaspoon Dried oregano,1 teaspoon Dried Thyme Leaves,1 teaspoon Black pepper powder,Salt - to taste,1 tablespoon Extra Virgin Olive Oil,2 Sweet Potatoes - skin peeled and chopped small,250 ml Milk,50 grams Butter,3 cloves Garlic - sliced,Salt and Pepper - to taste,1/2 cup Broccoli - cut into small florets,1/2 cup Red Bell pepper (Capsicum) - cut diagonally,1 Beetroot - cut diagonally,1 teaspoon Dried oregano,Salt and Pepper - to taste",Non Vegeterian,68
orange chiffon pie,207.5692138671875,3.887580633163452,11.158088684082031,23.136829376220703,pie,1449.870849609375,orange rasam recipe,"1 tablespoon Ghee,1/2 teaspoon Mustard seeds,2 teaspoon Cumin seeds (Jeera),5 Curry leaves,1/4 teaspoon Asafoetida (hing),4 cloves Garlic - crushed,5 Tomatoes - chopped & pureed,2 cups Fresh orange juice,Lemon - juice from half,1/2 teaspoon Turmeric powder (Haldi),1 Red Chilli powder,1 teaspoon Cumin powder (Jeera),1 teaspoon Coriander Powder (Dhania),1/2 teaspoon Black pepper powder,Salt - to taste,Coriander (Dhania) Leaves - freshly chopped,1/4 cup Arhar dal (Split Toor Dal) - cooked (optional)",Vegetarian,67
cream buns,215.74057006835935,4.451181888580322,15.809080123901367,14.162176132202148,bun,179.6714324951172,congress buns recipe,"4 Burger buns - or masala buns,4 tablespoon Green Chutney (Coriander & Mint),1 Onion - thinly sliced,1 Carrot (Gajjar) - grated,2 sprig Coriander (Dhania) Leaves - chopped,1 cup Raw Peanuts (Moongphali) - toasted,1/2 teaspoon Red Chilli powder,1/4 teaspoon Turmeric powder (Haldi),2 sprig Curry leaves,1/4 teaspoon Black pepper powder,pinch Asafoetida (hing),Salt and Pepper - to taste,1 tablespoon Sunflower Oil",Vegetarian,70
savoury puffs,190.7850799560547,9.510930061340332,15.242782592773438,10.800604820251465,puff,263.9988708496094,savoury bread pudding recipe,"6 Whole Wheat Brown Bread - preferably a day-old bread,1/2 Green zucchini - grated,1 Carrot (Gajjar) - grated,1 Red Bell pepper (Capsicum) - finely chopped,1 cup Spinach Leaves (Palak) - chopped,6 Button mushrooms - finely chopped,1 Onion - finely chopped,3 cloves Garlic - finely minced,2 teaspoon Extra Virgin Olive Oil,4 tablespoon Dijon Mustard,1 sprig Fresh Thyme leaves - or oregano or any herbs of choice,2 teaspoon Black pepper powder - crushed (or red chilli flakes),2 cups Milk,2 Whole Eggs - lightly whisked,1 cup Cheddar cheese - grated and for topping as well,4 tablespoon Butter - + 1 tablespoon for greasing the baking dish,Salt - to taste",Eggetarian,70
potato aigrettes,530.0274658203125,2.351202726364136,54.2388916015625,8.005807876586914,aigrette,219.40928649902344,potato latkes recipe,"4 Potatoes (Aloo),1 Onion - finely chopped,3 clove Garlic - grated,1 Whole Egg,1 teaspoon Whole Black Peppercorns - freshly ground,Salt - to taste,Extra Virgin Olive Oil - for shallow frying",Vegetarian,76
cream horns,408.22747802734375,3.4228012561798096,33.550270080566406,23.11704635620117,horn,469.9718933105469,creamy phirni recipe - north indian rice pudding,"250 grams Milk - full cream,1/2 cup Rice - soaked in water for at least 3 hours,2 Cardamom (Elaichi) Pods/Seeds - crushed,1 cup Sugar - adjustable,2 tablespoons Badam (Almond) - thinly sliced",Vegetarian,75
savoury cheese horns,295.1474609375,5.6605634689331055,20.705049514770508,21.3775634765625,horn,218.1631774902344,cheese tarts recipe,"1 cup Vivatta Maida,50 grams Butter - at room temperature salted or unsalted,1/4 cup Icing Sugar,1 Whole Eggs,1 teaspoon Vanilla Extract,Salt - a pinch if you are using unsalted butter,2 tablespoons Milk Powder,1 packet Britannia Cream Cheese - if you find it difficult to get cream cheese all you can do is take grated paneer add pinch salt n grind it in your mixer,1/3 cup Mozzarella cheese,1/4 cup Sugar,1 teaspoon Vanilla Extract,1 teaspoon Lemon juice - can add lemon zest as well,1 Whole Egg - 2 eggs depending on how many tarts you have prepared,1/4 cup Milk,1 teaspoon Corn flour,Salt - a pinch,25 grams Butter - 25 grams of butter,1 Egg yolks - or 2",Vegetarian,67
paneer patties,338.5819091796875,7.597538471221924,23.955602645874023,22.794984817504883,patty,340.98583984375,paneer frankie recipe - delicious kid friendly snack,"4 Whole Wheat Tawa Paratha - made into round large sizes for rolls,4 Lettuce leaves,200 grams Paneer (Homemade Cottage Cheese) - cut into strips,1 Red Bell pepper (Capsicum) - thinly sliced,1 Onion - thinly sliced,4 tablespoons Del Monte Tandoori Mayo",High Protein Vegetarian,71
vegetable patties,261.9207458496094,4.006119728088379,17.739768981933594,20.978593826293945,patty,303.0684814453125,caribbean vegetable patties recipe (hand pie),"2 cups All Purpose Flour (Maida),1/2 teaspoon Salt,1/2 teaspoon Turmeric powder (Haldi),1/2 teaspoon Curry powder,1/2 cup Butter - adjustable,1/2 cup Chilled water,1 cup Mixed vegetables - (beans,1/4 cup Cabbage (Patta Gobi/ Muttaikose) - chopped,1 Green Bell Pepper (Capsicum) - chopped,1 Tomato - chopped,1 Onion - chopped,1 teaspoon Ginger Garlic Paste,Salt - to tate,1 tablespoon Coconut Oil,1 teaspoon Paprika powder,1/2 teaspoon All spice powder,Nutmeg powder - a pinch,Cinnamon Powder (Dalchini) - a pinch",Vegetarian,100
pearl millet infant food (bajra shishu aahaar),362.4435119628906,11.982500076293944,6.624000072479248,62.09600067138672,,181.2217559814453,veggie pearl millet tart recipe,"1/2 cup Whole Wheat Flour,1/2 cup Bajra Flour ( Pearl Millet),1 teaspoon Baking powder,1 tablespoon Sugar,75 grams Butter - cold,1 tablespoon Sunflower Oil,2 tablespoons Chilled water,Salt - a pinch,2 tablespoons Paneer (Homemade Cottage Cheese) - crumbled,1/4 cup Spinach - finely chopped,1/4 cup Red Yellow and Green Bell Peppers (Capsicum) - finely chopped,1/4 cup Britannia Cream Cheese,Dried oregano - as required,1/4 teaspoon Black pepper powder,4 tablespoons Mozzarella cheese,Red Chilli flakes - as required",Vegetarian,67
cereal mix,120.80972290039062,3.318000078201294,2.0155999660491943,21.83839988708496,,151.01214599609375,homemade multigrain baby cereal recipe (baby porridge),"100 grams Brown Rice,100 grams Instant Oats (Oatmeal),50 grams Ragi Seeds,50 grams Barley (seeds)",Vegetarian,75
cereal pulse mix with amylase rice flour,151.57098388671875,4.26745080947876,2.7423529624938965,27.80470466613769,,128.83534240722656,rice flour bhakri recipe (maharashtrian tandalachi bhakri),"2 cups Rice flour,1/2 teaspoon Salt,Lukewarm Water - as required",Vegetarian,74
banana groundnut paste/puree,213.18800354003903,4.2729997634887695,5.451000213623047,36.15499877929688,,213.18800354003903,banana-almond butter bread recipe,"1 Ripe Bananas - (over ripe),1 Whole Egg,1/4 cup Sugar,2-1/2 tablespoons Almond butter,5 tablespoons Vivatta Maida,3 tablespoons Almond Meal (Badam Powder),1/2 teaspoon Baking powder,1/4 teaspoon Baking soda,1/4 teaspoon Cinnamon Powder (Dalchini),1 pinch Salt,1/4 teaspoon Vanilla Extract - or almond extract,2 tablespoons Slivered Almonds (Badam),2 tablespoons Chocolate ganache - or melted chocolate",Eggetarian,100
rice dal porridge (chawal dal ki khichdi/khichri),383.33209228515625,10.79699993133545,8.329000473022461,65.03800201416016,,127.7773666381836,chinese savoury rice porridge recipe with pumpkin,"1 cup Rice,1 cup Kaddu (Parangikai/ Pumpkin) - cut into cubes,6 cups Water - or Vegetable Stock,Salt - to taste,Whole Black Peppercorns - freshly crushed,1 teaspoon Ginger - grated or cut into thin strips,Spring Onion Greens - chopped,Coriander (Dhania) Leaves - chopped",Vegetarian,87
lentils and semolina porridge (dal suji porridge/daliya),117.28924560546876,3.261500120162964,1.061500072479248,23.19099998474121,,234.5784912109375,semolina porridge fruit & nut breakfast bowl recipe,"2 tablespoons Sooji (Semolina/ Rava),2 tablespoons Water,1/2 cup Milk,1/4 teaspoon Vanilla Extract,1/4 teaspoon Cinnamon Powder (Dalchini),Honey - to taste,4 Multigrain Digestive Biscuits,8 Strawberries,2 tablespoons Badam (Almond) - slivered,2 tablespoons Pistachios - slivered",Vegetarian,74
